{
  "schemaVersion": 1,
  "id": "claude-opus-5",
  "displayName": "Claude Opus 5",
  "enabled": true,
  "runner": "claude",
  "model": "claude-opus-5",
  "provider": {
    "id": "anthropic",
    "name": "Anthropic"
  },
  "authentication": {
    "type": "claude-login"
  },
  "reasoning": {
    "default": "high",
    "allowed": [
      "low",
      "medium",
      "high",
      "xhigh",
      "max"
    ],
    "control": "effort-flag"
  },
  "supportedMethods": [
    "threejs",
    "twigl"
  ]
}
